Rank,Exercise Name,Level,Primary Muscle,CNS,Sets,Reps,Time Goal,Rest,Primary Focus,Stars,Pre-Req,HS Goals,College Goals,Description,Proper Form,demo,env,sport,Description
69,Partner Jump,Beg,Quads,High,4,5,--,90s,Plyo Power,⭐⭐⭐,None,Vert. Jump,Explosiveness,Plyometric power development.,Jump vertically; partner resists via band.,Watch Video,all,,Plyometric power development.
1,Kneeling Row,Beg,All,Back,Low,3,12ea,--,45s,Unilat. Pull,⭐,None,Flat Back,Scap. Control,Targets back independently to fix imbalances.,Watch Video,🎥,all,Scap. Control
2,Glute Bridge,Beg,All,Hamstrings,Low,3,15,30s Hold,30s,Post. Chain,⭐,None,Hip Extension,Glute Active,Performed as a hold/rep to recruit hip stabilizers.,Watch Video,🎥,all,Glute Active
3,Fire Hydrant,Beg,All,Glutes,Low,3,15ea,--,30s,Glute Medius,⭐,None,Core Stability,Hip Mobility,Isolation movement targeting glutes via lateral lift.,Watch Video,🎥,all,Hip Mobility
4,SL RDL w/ Row,Beg,All,Back,High,3,10ea,--,60s,Balance/Pull,⭐⭐⭐,RDL Form,Ankle Stability,CNS Integration,Combines hinge balance with a row for posture.,Watch Video,🎥,all,CNS Integration
5,Glute Thrust,Beg,All,Hamstrings,Med,3,12,--,45s,Power Ext.,⭐⭐,Bridge,Snap Hips,Power Output,Amplifies bridge benefits by adding explosive resistance.,Watch Video,🎥,all,Power Output
6,Standing Hip Ext,Beg,All,Glutes,Low,3,15ea,--,30s,Glute Max,⭐,None,No Back Arch,Postural Hold,Standing isolation extending leg out behind you.,Watch Video,🎥,all,Postural Hold
7,Tricep Press,Beg,All,Triceps,Low,3,12ea,--,30s,Arm Isolation,⭐,None,Full Lockout,Muscle Tone,Portable way to target triceps through full range.,Watch Video,🎥,all,Muscle Tone
8,Hip Thrust,Beg,All,Glutes,Med,4,12,--,60s,Peak Glute,⭐⭐,Bridge,Knee Alignment,Max Contract,Compound move using band for hip abduction.,Watch Video,🎥,all,Max Contract
9,Overhead Fly,Beg,All,Shoulders,Low,3,15,--,30s,Rear Delt,⭐,None,Shoulder Health,Scap. Stability,Targets deltoids and upper back for aesthetics.,Watch Video,🎥,all,Scap. Stability
10,Lateral Walk,Beg,All,Abductors,Med,3,15ea,--,45s,Lat. Stability,⭐⭐,Squat Form,Knee Tracking,Lateral Speed,Challenges hip abduction and lateral stability.,Watch Video,🎥,all,Lateral Speed
11,Kneeling Curl,Beg,All,Biceps,Low,3,12ea,--,30s,Bicep Iso,⭐,None,Still Elbows,Peak Tension,Isolates biceps while engaging kneeling core.,Watch Video,🎥,all,Peak Tension
12,Mini Band Squat,Beg,All,Quads,Med,3,15,--,45s,Knee Tracking,⭐⭐,Body Squat,Knees Out,Squat Depth,Forces recruitment to prevent knee collapse.,Watch Video,🎥,all,Squat Depth
13,Side-Lying Clam,Beg,All,Abductors,Low,3,20ea,--,30s,Hip Stability,⭐,None,Hips Square,Pelvic Control,Classic PT move for hip and pelvic health.,Watch Video,🎥,all,Pelvic Control
14,Lat. Sh. Raise,Beg,All,Shoulders,Low,3,12ea,--,30s,Medial Delt,⭐,None,No Shrugging,Shoulder Width,Variable tension increases difficulty vs DBs.,Watch Video,🎥,all,Shoulder Width
15,Alt. Leg Raises,Beg,All,Quads,Med,3,10ea,--,45s,Lower Ab,⭐⭐,Plank,Flat Low Back,Core Endurance,Challenges core/flexors via resisted lifts.,Watch Video,🎥,all,Core Endurance
16,Alt. Lat. Raise,Beg,All,Shoulders,Low,3,12ea,--,30s,Stability,⭐,None,Stability,Coordination,Alternating sides increases core time under tension.,Watch Video,🎥,all,Coordination
17,Mini Band Lunge,Beg,All,Quads,Med,3,10ea,--,45s,Quad Stability,⭐⭐,Lunge,Balanced Torso,Knee Tracking,Intensifies lunge by adding stabilizer tension.,Watch Video,🎥,all,Knee Tracking
18,Side Hip Abduct,Beg,All,Abductors,Low,3,15ea,--,30s,Hip Strength,⭐,None,Leg Straight,Hip Stability,Isolates outer glute and hip muscles.,Watch Video,🎥,all,Hip Stability
19,Reverse Fly,Beg,All,Shoulders,Low,3,15,--,30s,Post. Delt,⭐,None,Posture,Scap. Retract,Improves posture by strengthening rear delts.,Watch Video,🎥,all,Scap. Retract
20,Toe Touch,Beg,All,Abs,Med,3,20,--,30s,Ab Tone,⭐⭐,Crunch,Reach High,Ab Definition,Increases resistance during resisted crunch.,Watch Video,🎥,all,Ab Definition
21,Leg Raise,Beg,All,Abs,High,3,12,--,60s,Core Strength,⭐⭐⭐,Alt. Leg Raise,No Back Arch,Core Bracing,Intensifies challenge on lower abs/flexors.,Watch Video,🎥,all,Core Bracing
22,Jump Squat,Beg,All,Quads,High,4,8,--,90s,Explosive,⭐⭐⭐,Squat,Soft Landing,Vertical Leap,Combines plyometrics with resistance.,Watch Video,🎥,all,Vertical Leap
23,Lunge Kickback,Beg,All,Quads,Med,3,10ea,--,45s,Post. Chain,⭐⭐,Lunge,Balance,Triple Ext.,Enhances hip extension with a lunge kickback.,Watch Video,🎥,all,Triple Ext.
24,Plank Kickback,Beg,All,Abs,High,3,10ea,--,60s,Core/Glute,⭐⭐⭐,Plank,Level Hips,Anti-Rotation,Challenges core while firing the glute.,Watch Video,🎥,all,Anti-Rotation
25,Mt. Climber,Beg,All,Abs,High,3,20ea,30s Sprint,60s,Metabolic,⭐⭐⭐,Plank,Fast Feet,Engine Build,High-intensity move with resisted knee drive.,Watch Video,🎥,all,Engine Build
26,Scap Retraction,Beg,All,Shoulders,Low,3,15,--,30s,Upper Back,⭐,None,Scap. Move,Shoulder Health,Focuses on shoulder blade movement.,Watch Video,🎥,all,Shoulder Health
27,Around World,Beg,All,Abs,High,3,5ea,--,60s,Elite Stab.,⭐⭐⭐,Plank,Total Control,Shoulder/Core,Complex plank lifting limbs against a tug.,Watch Video,🎥,all,Shoulder/Core
28,Hip Flexor,Beg,All,Quads,Med,3,15ea,--,30s,Stride Power,⭐⭐,None,Drive Knee,Sprint Power,Essential for improving sprint knee drive.,Watch Video,🎥,all,Sprint Power
29,Scissor Kick,Beg,All,Abs,Med,3,--,45s Work,45s,Ab Endurance,⭐⭐,Leg Raise,Speed/Tension,Lower Ab Power,Intensifies flutter kick for activation.,Watch Video,🎥,all,Lower Ab Power
30,Standing Flexion,Beg,All,Quads,Low,3,15ea,--,30s,Hip Mobility,⭐,None,Tall Spine,Balance,Standing isolation for flexors and quads.,Watch Video,🎥,all,Balance
31,Bridge w/ Raise,Inter,All,Glutes,High,3,8ea,--,60s,Unilat. Stab.,⭐⭐⭐,Bridge,Hips High,Core Sync,Addresses strength imbalances between sides.,Watch Video,🎥,all,Core Sync
32,Hydrant Circle,Beg,All,Abductors,Med,3,10ea,--,30s,Hip Range,⭐⭐,Hydrant,Fluid Motion,Joint Health,Enhances mobility via circular motions.,Watch Video,🎥,all,Joint Health
33,Banded Curtsy,Inter,All,Quads,Med,3,12ea,--,45s,Side Glute,⭐⭐,Lunge,Torso Facing,Hip Mobility,Engages hips/glutes more than standard lunge.,Watch Video,🎥,all,Hip Mobility